{
  "findings": [
    {
      "type": "documentation",
      "summary_keywords": ["delete", "docs"],
      "endpoint": "/api/v1/users",
      "required_evidence": [
        "docs say DELETE",
        "POST",
        "delete"
      ],
      "forbidden_claims": [
        "database bug",
        "data loss"
      ]
    }
  ],
  "expect_no_feedback": false,
  "report_requirements": [
    "docs",
    "POST"
  ],
  "forbidden_report_claims": [
    "the api is broken"
  ]
}
